{"authorized_at_utc":"2026-07-23T23:30:09Z","candidate_root":"/tmp/hde-epic038-ops03/ops03-rolefix-afdd3ab792724569a7c24f83/candidate/","exact_argv":{"capture":["/tmp/hde-epic038-ops03-tooling.JUMu5e/python/bin/python3","-I","-B","/tmp/hde-epic038-ops03-source.2eNqP5/repo/scripts/ops/hde_epic038_ops03.py","--authorization","/tmp/hde-epic038-ops03-auth.Y92Eu7/authorization.json"],"receipt":["/tmp/hde-epic038-ops03-tooling.JUMu5e/python/bin/python3","-I","-B","/tmp/hde-epic038-ops03-source.2eNqP5/repo/tools/evidence/hde_epic038_ops03.py","--emit-receipt","--authorization","/tmp/hde-epic038-ops03-auth.Y92Eu7/authorization.json","--candidate","/tmp/hde-epic038-ops03/ops03-rolefix-afdd3ab792724569a7c24f83/candidate"],"validate":["/tmp/hde-epic038-ops03-tooling.JUMu5e/python/bin/python3","-I","-B","/tmp/hde-epic038-ops03-source.2eNqP5/repo/tools/evidence/hde_epic038_ops03.py","--validate","--authorization","/tmp/hde-epic038-ops03-auth.Y92Eu7/authorization.json","--candidate","/tmp/hde-epic038-ops03/ops03-rolefix-afdd3ab792724569a7c24f83/candidate"]},"expected_counts":{"alternate_provider_attempts":0,"direct_connections":2,"health_connections":1,"health_sql_statements":1,"posture_sql_statements":10,"posture_transactions":1,"provider_selections":1,"retries":0,"sql_statements":11,"sql_writes":0},"expires_at_utc":"2026-07-24T01:30:09Z","interpreter":{"resolved_path":"/tmp/hde-epic038-ops03-tooling.JUMu5e/python/bin/python3","sha256":"46d05ca7094b029959f0218e990a7f2737dbc87d5b2e783ecfc44e978937922a"},"one_attempt":true,"ordered_query_ids":["set_transaction_read_only","set_search_path","connection_identity","search_path","runtime_role_grants","ddl_columns","ddl_constraints","boundary_views","partition_inventory","partition_verify"],"rails":{"allow_db_write":"0","allow_network":"0","db_read_authorized":true,"safe_mode":"1"},"retired_keys_required_absent":["DB_ALLOW_BRIDGE_IN_PROD","DB_BRIDGE_URL","DB_FORCE_BRIDGE"],"run_id":"ops03-rolefix-afdd3ab792724569a7c24f83","runner_sha256":"5b49fdf4fa7eefe05fdafa7fd5dbd202a80602535c84b2481ebac4525547ea8f","schema":"hde_epic038.ops03.authorization.v1","source_commit":"043dd6b9751442d7a9329ccfff9f6483a9d4fee2","target":{"app_env":"dev","database_schema":"hde","search_path":["hde","public"]},"validator_sha256":"eebb11ef5d8352deb882dd50a49dac6e08ed8cb10d0c729031fb5c11a3b69d8f"}
